{
  "schema_version": "1.0",
  "manifest_id": "public-fixture-manifest-001",
  "request_id": "public-fixture-search-001",
  "created_at": "2026-04-24T00:00:00Z",
  "export_status": "manifest_only_fixture",
  "approval": {
    "status": "proposed",
    "required_before_materialization": true
  },
  "summary": {
    "item_count": 1,
    "counts_by_asset_type": {
      "deck_component": 1
    }
  },
  "items": [
    {
      "export_item_id": "deck_module:fixture-kpi-card",
      "asset_type": "deck_component",
      "relative_path": "templates/modules/fixture-kpi-card.module.json",
      "private_storage_ref_redacted": true
    }
  ]
}
